name,metrics,data_sources
Popularity,User ratings; Number of downloads; Active user base,App Annie; Apple App Store; Google Play Store
Features,User engagement features; Integration with other platforms; Integration capabilities; Variety of tracking options; Integration with other services,Tech review sites; User reviews; Official app websites; Tech blogs
User Experience,App interface design; Customer support; Ease of use; App design,UX design reports; App Store reviews; User reviews; App testing reports; User feedback; UX design analysis; App reviews; Tech review sites; Tech blogs
User Engagement,Number of active users; User retention rate,App Store reviews; Google Play Store reviews; Industry reports
Feature Set,Variety of tracking features; Integration with other platforms,Official app websites; User reviews; Tech blogs
User Ratings,Average rating score; Number of ratings,App Store; Google Play Store
Innovation,Unique features; Recent updates,Tech news; App update logs
Market Presence,Download numbers; Global availability,App Store; Google Play Store; Industry analysis reports
