name,description,type,sources
Cross-Platform Availability,"The availability of the app across different platforms (iOS, Android, Web, etc.).",Text [*],"Amazon Appstore, App Store, App Store Listings, App Store descriptions, App Store listings, App store descriptions, App store listings, Apple App Store, Google Play, Google Play Store, Official App Websites, Official Websites, Official app descriptions, Official app documentation, Official app websites, Tech Blogs, app store descriptions, app store listings, company websites, official app websites, tech blogs"
Ease of Use,How intuitive and user-friendly the app interface is.,Text[1],"AMZScout, App Store feedback, App reviews and comparisons, Crosslist, Editor reviews, Elite Daily, Expert Reviews, Expert reviews, Facebook Live, Filestage, Go Live, Google Drive Review, Greenlight, Honeygain, Multiple Sources, Multiple sources, Personal Experience, Prism Live Studio, SaleHoo, Shopify Australia, SimiCart, Sterling College, StreamYard, Tom's Guide, User Reviews, User reviews, Various sources, Zapier, app descriptions, app reviews, app store comments, app store descriptions, app store rating, app store ratings, editor reviews, expert reviews, multiple sources, user reviews"
Feature Set,Range and quality of photo effects and editing tools offered by the app.,Text [1],"App Descriptions, App Store, App Store descriptions, App descriptions, Google Play Store, Official App Descriptions, Official App Website, Official App Websites, Official app descriptions, Official app websites, Platform feature documentation, Platform feature lists, Product descriptions, Tech reviews, User Manuals, User Reviews, comparative analyses, expert reviews, feature comparison articles, official websites, tech articles, tech blogs, turn0news16, turn0news20, user manuals, user reviews"
Platform Availability,"The range of operating systems and devices on which the app is available (e.g., iOS, Android, Web).",Text [1],"Amazon Music, Anghami, App Documentation, App Store, App Store Listings, App Store descriptions, App Store listings, App documentation, App official website, App store listings, Apple Music, Audiomack, Boomplay, Company Website, Company Websites, Deezer, Gaana, Google Play Store, Hungama Music, JioSaavn, Napster, Official App Descriptions, Official App Documentation, Official App Website, Official App Websites, Official Website, Official Websites, Official app websites, Pandora, Qobuz, Smart Shuffle, SoundCloud, Spotify, TechRadar, Tidal, Trebel, Wikipedia, Wynk Music, YouTube Music, app store listings, app stores, iHeartRadio, official websites, turn0news13, turn0news14, turn0news17, turn0news23, turn0search0, turn0search1, turn0search15, turn0search16, turn0search17, turn0search19, turn0search2, turn0search20, turn0search3, turn0search4, turn0search5, turn0search7"
User Interface,The ease of navigation and overall user experience of the app.,Text[1],"13, Amazon Appstore, App Reviews, App Store, App Store Comments, App Store Reviews, App Store descriptions, App Store ratings, App store descriptions, App store reviews, Appy Pie, CNET, CyberLink, Editor reviews, Expert Reviews, Expert reviews, Expert reviews from tech blogs, Google Play, Google Play Reviews, Google Play Store, Lake Travis Community Library, Multiple, Multiple Sources, Multiple sources, Personal Testing, Personal testing, Review articles, Source 9, Tech Blogs, Tech blogs, Tech reviews, User Feedback, User Reviews, User reviews, User reviews on app stores, YouTube, YouTube tutorials, app descriptions, app reviews, app screenshots, app store descriptions, app store ratings, expert analyses, expert evaluations, expert opinions, expert reviews, independent reviews, official app descriptions, official app websites, personal assessment, personal testing, tech blogs, tech reviews, user feedback, user reviews"
User Interface and Experience,The ease of use and overall user experience of the app.,Text [1],"App Reviews, App Store Ratings, App Store Reviews, App Store descriptions, App Store listings, App Store ratings, App Store reviews, App Stores, App reviews, AppStore reviews, Design Blogs, Design critiques, Expert Reviews, Expert analyses, Expert critiques, Expert reviews, GSM Arena, Google Play Store Reviews, Google Play ratings, Mashable, Official app websites, PCMag, PlayStore reviews, Tech blogs, Tech reviews, TechCrunch, TechRadar, Trustpilot, UI/UX Analysis Reports, UI/UX design awards, UI/UX design blogs, UX design critiques, UX design reviews, Usability testing reports, User Feedback, User Reviews, User feedback, User reviews, User reviews on app stores, YouTube reviews, app design awards, app store listings, app store ratings, design awards, expert analyses, expert analysis, expert opinions, expert reviews, expert reviews from TechCrunch, official app websites, tech blogs, tech reviews, third-party reviews, usability studies, usability testing reports, user feedback, user feedback on app stores, user reviews, user reviews on app stores"
User Ratings,The average rating given by users on app stores.,Float [1],"Amazon Appstore, App Annie, App Store, App Store Reviews, App Store ratings, App Stores, App store listings, App store ratings, App stores, AppAnnie, AppStore, Apple App Store, Capterra, G2, Google Play, Google Play Store, Google Play ratings, Microsoft Store, PlayStore, Sensor Tower, Trustpilot, other app marketplaces, review aggregation sites, review websites, tech reviews, third-party review aggregators, third-party review platforms, third-party review sites, third-party review websites, user feedback, user review aggregators, user review platforms, user review websites, user reviews"
