name,metrics,data_sources
User Popularity,Number of downloads; User ratings,Google Play Store; Apple App Store
Feature Set,GPS tracking; Workout logging; Social sharing features,Official app websites; User reviews
Integration Capabilities,Compatibility with wearables; Third-party app integrations,Official app websites; Tech review sites
User Engagement,Active user base; Community features,App analytics reports; User forums
Updates and Support,Frequency of updates; Customer support quality,App update logs; User feedback platforms
