name,description,type,sources
Active User Base,Estimated number of active users or downloads.,Integer [1],"App Store, Google Play Store, company reports"
Active Users,Estimated number of active users or downloads,Integer [1],"App Store, Company Reports, Google Play Store"
Ad Intrusiveness,The presence and intrusiveness of advertisements within the app.,Text [1],"turn0search0, turn0search4"
Ad Support,Whether the app is free with ads or requires a subscription to remove ads.,Boolean [1],([techradar.com](https://www.techradar.com/streaming/draft-best-free-streaming-service-2024-tubi-pluto-tv-the-roku-channel-and-more?utm_source=openai))
Ad-Supported Free Access,Whether the platform offers free content with advertisements.,Boolean [1],"Official app websites, Official platform websites, industry reports, service descriptions, user reviews"
Ad-Supported Options,Availability of free or lower-cost tiers that include advertisements.,Boolean [1],"Official app websites, industry reports"
Additional Features,"Extra functionalities offered by the app, such as cloud storage integration, media playback, or collaboration tools.",Text [*],"App Descriptions, App Store, Google Play Store, Official app documentation, Official app websites, User Reviews, app store listings, feature lists, turn0news12, turn0news13, turn0news15, turn0news16, user manuals, user reviews"
Analytics and Reporting,Availability of detailed analytics and performance metrics to help creators understand their audience and improve content.,Boolean,"Official app websites, user reviews"
Audience Engagement Tools,"Features that facilitate interaction with viewers, including live chat, polls, Q&A sessions, and interactive overlays.",Boolean,"Official app websites, user reviews"
Audio Quality,"Maximum audio quality offered by the app (e.g., standard, high, lossless).",Text [1],"Amazon Music, Anghami, App Reviews, App Store listings, App official documentation, App technical specifications, Apple Music, Audiomack, Boomplay, Deezer, Gaana, Hungama Music, JioSaavn, Napster, Official app websites, Qobuz, SoundCloud, Spotify, Tidal, Trebel, User Feedback, User reviews, Wynk Music, industry reports, press releases, technical specifications, turn0search17, turn0search19, turn0search20"
Audio Quality Enhancements,"Features that improve audio playback, such as variable speed control, silence trimming, or volume boosting.",Text [*],"App Store listings, Official app websites"
Availability Information,"Information on where to stream or purchase movies, including integration with streaming services.",Boolean [1],"App feature descriptions, App integrations, Streaming service data"
Availability on Multiple Platforms,The app is available on both iOS and Android platforms.,Boolean [1],"App Store, Google Play Store"
Barcode Scanning,Feature to scan product barcodes for instant price comparison.,Boolean [1],"turn0search0, turn0search4, turn0search5, turn0search6, turn0search7, turn0search8, turn0search9"
Broadcasting Capabilities,"The app's ability to send messages to multiple contacts simultaneously, including features like group chats, channels, or broadcast lists.",Boolean,"turn0news13, turn0news14, turn0search0, turn0search1, turn0search15, turn0search16, turn0search17, turn0search2, turn0search3, turn0search4, turn0search5"
Broadcasting Features,"The ability to send messages to multiple contacts simultaneously, including group chats and channels.",Boolean [1],"App Documentation, User Reviews"
Cashback Offers,Provision of cashback rewards on purchases made through the app.,Boolean [1],"Official app websites, User reviews, turn0search4, turn0search5, turn0search7, turn0search8"
Cloud Gaming Support,"Availability of cloud gaming services, allowing users to play games without local installations.",Text [1],"turn0search2, turn0search7"
Collaboration Features,The tools and functionalities that enable multiple users to work together on notes or projects within the app.,Text [*],"Official app websites, feature comparison articles, user reviews"
Collaboration Tools,"Features that facilitate teamwork, such as shared workspaces, task assignments, and real-time editing.",Text [1],"App feature lists, TechRadar, Wikipedia, turn0search18, turn0search19, user reviews"
Communication Features,"Tools available for messaging, video calls, and real-time collaboration.",Text [1],"App feature lists, App official websites, AppyPie, PCMag, TechRadar, Wikipedia, turn0news12, turn0news13, turn0news17, user reviews"
Community and Social Features,"Features that allow user interaction, such as commenting, sharing, or live discussions.",Text [*],"App Store listings, Official app websites, user reviews"
Community and Support,"The availability of user communities, forums, and official support channels for assistance and sharing best practices.",Text [1],"Official app websites, tech blogs, user forums"
Community Engagement,Level of user interaction and community features within the app.,Text [1],"App feature descriptions, App feature set, Official App Descriptions, Official app websites, User Reviews, User forums, User reviews, app descriptions, platform community pages, platform forums, user forums"
Community Features,"Social functionalities such as commenting, sharing, and interacting with other listeners.",Boolean [1],"App Store listings, Official app websites"
Community Support,Presence of an active user community or support forums,Boolean [1],"Official app websites, social media platforms"
Content Curation,The quality and relevance of content recommendations provided to users.,Text [1],"User reviews, industry analyses"
Content Focus,"The primary type of content the platform is known for, such as gaming, professional events, or social interactions.",Text [1],"Official app websites, Platform official descriptions, user reviews, user-generated content analysis, user-generated content trends"
Content Genre Variety,The diversity of movie genres available on the platform.,Text [*],"Official app websites, content libraries"
Content Library,The size and diversity of the podcast library available through the app.,Text [1],"App Descriptions, App Store listings, Official app websites, User Feedback, User reviews"
Content Library Size,The total number of movies and TV shows available on the platform.,Integer [1],"App Store, Google Play Store, Official App Websites, Official app websites, Official platform websites, Press Releases, industry reports"
Content Moderation Features,Tools available to manage and moderate user-generated content to ensure community guidelines are upheld.,Boolean,"Official app websites, user reviews"
Content Quality,Availability of high-definition and 4K content.,Boolean [1],"Official app websites, tech specifications"
Content Variety,"The range and diversity of live streaming content available on the platform, including genres like sports, gaming, entertainment, and news.",Text [*],"([time.com](https://time.com/7004929/best-streaming-service-for-movies-tv-sports/?utm_source=openai)), Platform content guidelines, Platform official websites, turn0news13, turn0news14, turn0news15, turn0news16, turn0news17, turn0search0, turn0search1, turn0search2, user reviews, user-generated content analysis"
Controller Support,"Compatibility with various gaming controllers, enhancing gameplay options.",Text [*],"Official app websites, technical reviews, turn0search1, turn0search2, user manuals, user reviews"
Cost,"The pricing structure of the app, including free tiers and subscription options.",Text [1],"([tomsguide.com](https://www.tomsguide.com/us/youtube-tv-faq%2Creview-5059.html?utm_source=openai)), App Documentation, App Store, App Store Listings, Company Pricing Pages, Company Website, Google Play Store, Official App Documentation, Official Pricing Page, Official Pricing Pages, Official app websites, Official pricing pages, Platform official websites, app store listings, turn0news13, turn0news14, turn0news16, turn0search0, turn0search1, turn0search2, turn0search3, turn0search4, turn0search5, user reviews"
Cost and Accessibility,"The affordability of the service, including subscription fees, availability of free content, and device compatibility.",Text [1],([techradar.com](https://www.techradar.com/streaming/draft-best-free-streaming-service-2024-tubi-pluto-tv-the-roku-channel-and-more?utm_source=openai))
Cost and Subscription Options,"Information on whether the app is free, offers in-app purchases, or requires a subscription.",Text [1],"App Descriptions, App store listings, App websites, Official Pricing Pages, Official app websites, pricing pages, turn0news13, turn0news15"
Cost and Subscription Plans,"The pricing structure of the app, including free tiers, subscription plans, and any associated costs.",Text [1],"Official app documentation, Official app websites, Official pricing pages, app store listings, pricing pages, third-party reviews"
Cost and Value,"The pricing structure of the app relative to the features provided, assessing its overall value proposition.",Text [1],"turn0news16, turn0news20"
Coupon Availability,Number and variety of coupons available through the app.,Integer [1],"Official app websites, User reviews, turn0search3, turn0search4, turn0search8"
Coupon Integration,Availability of coupons and promo codes to apply additional discounts.,Boolean [1],"turn0search1, turn0search2, turn0search3, turn0search4, turn0search5, turn0search6, turn0search7, turn0search8"
Cross-Platform Availability,"The app's availability across multiple operating systems and devices, ensuring seamless access.",Text [1],"turn0news16, turn0news20"
Cross-Platform Sharing,"The app's capability to transfer files between different operating systems, such as iOS to Android.",Boolean [1],"Official app documentation, user reviews"
Cross-Platform Synchronization,The ability to sync listening progress and subscriptions across multiple devices.,Boolean [1],"App Store listings, Official app websites, user reviews"
Cross-Platform Syncing,Ability to synchronize listening progress and subscriptions across multiple devices.,Boolean [1],"App Store listings, Official app websites"
Customer Support,The availability and quality of customer support services.,Text [1],"Company Website, Official App Documentation, Official App Website, Official app websites, Support Pages, User Reviews, User Testimonials, User reviews, official app websites, official support channels, user reviews"
Customer Support and Reliability,The quality of customer support and the app's reliability.,Text [1],"User reviews, support forums"
Customer Support Quality,The responsiveness and helpfulness of the app's customer support services.,Text [1],"User reviews, support forums"
Customization,Options available to tailor the app to specific team needs and workflows.,Text [1],"TechRadar, Wikipedia"
Customization and Extensibility,The extent to which the app allows customization and supports plugins or extensions.,Text [*],"Official app websites, developer documentation, user manuals, user reviews"
Customization Options,The extent to which users can customize the app's appearance and functionality.,Text [1],"App documentation, Official app websites, turn0search1, turn0search11, turn0search2, turn0search4, user reviews"
Data Accuracy,Reliability and accuracy of movie data and recommendations.,Text [1],"Official App Descriptions, User Reviews, User reviews, expert reviews"
Data Accuracy and Completeness,The comprehensiveness and accuracy of the movie database used by the app.,Boolean [1],"App data sources, App feature descriptions"
Data Privacy,Policies and practices regarding user data privacy,Text [1],"Official App Website, Privacy Policy"
Data Privacy and Security,Measures taken to protect user data and privacy.,Boolean,App privacy policies
Device Compatibility,"The range of devices (e.g., smartphones, smart TVs, streaming devices) that support the platform's app.",Text [*],"([tomsguide.com](https://www.tomsguide.com/us/youtube-tv-faq%2Creview-5059.html?utm_source=openai)), Official app websites, Official platform support pages, Platform official documentation, Platform official websites, Platform technical specifications, app store listings, industry reports, support pages, tech blogs, turn0news13, turn0news14, turn0news15, turn0news16, turn0search0, turn0search1, turn0search2, user guides, user manuals, user reviews"
Ease of Use,User-friendliness and intuitiveness of the app interface.,Text [1],"App Store, App Store Ratings, App Store descriptions, Expert Reviews, Google Play Store, User Reviews, User experience reviews, User reviews, app descriptions, app tutorials, expert analyses, expert reviews, independent app evaluations, platform tutorials, tech blogs, usability studies"
Editing Features,Range of photo editing tools and customization options.,Text [1],"App Store, Google Play Store, Official App Websites"
End-to-End Encryption,"Whether the app provides end-to-end encryption for messages, ensuring privacy.",Boolean [1],"App security documentation, privacy policies"
Exclusive Content,"Availability of exclusive songs, albums, or artist collaborations not found on other platforms.",Boolean [1],App official announcements
Exclusive Titles,"Availability of games that are exclusive to the platform, offering unique gaming experiences.",Integer [1],"Official app websites, gaming news outlets"
Feature Set,Range and quality of photo effects and editing tools offered by the app.,Text [1],"App Descriptions, App Store, App Store descriptions, App descriptions, Google Play Store, Official App Descriptions, Official App Website, Official App Websites, Official app descriptions, Official app websites, Platform feature documentation, Platform feature lists, Product descriptions, Tech reviews, User Manuals, User Reviews, comparative analyses, expert reviews, feature comparison articles, official websites, tech articles, tech blogs, turn0news16, turn0news20, user manuals, user reviews"
Features,"The range of functionalities offered by the app, such as messaging, video calls, group chats, and unique features.",Text [*],"App Descriptions, App Store, Company Websites, Google Play Store, Official App Websites, User Reviews"
File Sharing and Storage,Functionalities that enable users to share and store files securely within the app.,Text [1],"turn0news13, turn0news14, turn0news17"
File Size Limit,The maximum allowable size for a single file transfer.,Integer (MB/GB) [1],"Official app documentation, Official app websites, turn0search0, turn0search1, turn0search2, user manuals, user reviews"
File Size Limitations,"The maximum file size the app allows for transfer, indicating suitability for large files.",Integer [1],"Official app documentation, Official app specifications, turn0news12, turn0news13, turn0news14, turn0news21, turn0news22, turn0news23, turn0search0, turn0search1, turn0search15, turn0search16, turn0search17, turn0search18, turn0search19, turn0search20, user reviews"
File Transfer Speed,The rate at which files can be transferred between devices or over the internet.,Float (MB/s) [1],"turn0news12, turn0news13, turn0news14, turn0news21, turn0news22, turn0news23, turn0search0, turn0search1, turn0search15, turn0search16, turn0search17, turn0search18, turn0search19, turn0search20"
File Type Support,"The variety of file types and formats that can be transferred using the app, including documents, images, videos, and executables.",Text [*],"Official app documentation, Official app websites, user manuals, user reviews"
Free Trial Availability,"Whether the service offers a trial period at no cost, allowing users to evaluate before subscribing.",Boolean [1],"Official app websites, promotional materials"
Game Library Size,The number of games available through the app.,Integer [1],"App Descriptions, Official Websites, Official app websites, app store listings, gaming news outlets, press releases"
Game Organization,Features related to organizing and managing game libraries within the app.,Text [1],"turn0search0, turn0search1, turn0search4"
Geographic Availability,The countries or regions where the platform is accessible.,Text [*],"Official app websites, industry reports, service descriptions"
Geographical Availability,The countries or regions where the platform is accessible.,Text [*],"Official app websites, industry reports, press releases, service announcements"
Geographical Reach,The regions or countries where the platform operates and has a significant user base.,Text [1],"Platform official information, Platform official websites, Platform's about page, industry analyses, industry reports"
Group Size Limit,The maximum number of contacts to whom a message can be broadcast simultaneously.,Integer [1],"App Documentation, Company Support Pages, Official App Documentation, Official app documentation, Support Pages, User Reviews, app store listings, user guides"
Integration Capabilities,"The ability to integrate with other tools and platforms, such as CRM systems or email services.",Text [*],"API Documentation, App Documentation, App documentation, App feature lists, AppyPie, Company Support Pages, Company Website, Integration Guides, Official App Documentation, Official app documentation, Official app websites, PCMag, TechRadar, Third-Party Reviews, integration documentation, integration guides, tech reviews, third-party reviews, turn0news12, turn0news14, turn0news16, turn0news17, user manuals, user reviews"
Integration with Other Platforms,Ability to stream simultaneously to multiple platforms or integrate with social media for broader reach.,Boolean,"Official app websites, user reviews"
Integration with Other Services,"The app's compatibility and integration with other platforms and services, such as smart speakers or social media.",Text [1],"App Descriptions, App Store listings, App features, Official app documentation, Official app websites, Official integration documentation, User Manuals, technical specifications, user forums, user manuals, user reviews"
Integration with Retailers,Number and variety of retailers the app integrates with,Integer [1],"App Store Description, Official App Website"
Integration with Streaming Services,Ability to integrate with various streaming platforms for seamless viewing.,Text [1],"App descriptions, Official App Descriptions, User Reviews, user reviews"
Integrations,The ability to connect with other apps and services to enhance functionality.,Text [1],"App official websites, TechRadar, Wikipedia, user reviews"
Interactive Features,"Tools available for audience engagement, like live chat, polls, or Q&A sessions.",Boolean [1],"([blog.bigo.tv](https://blog.bigo.tv/en/best-apps/best-live-video-apps/?utm_source=openai)), Platform feature documentation, Platform feature lists, turn0search1, turn0search2, user reviews"
Interactivity Features,"Tools available for audience engagement, such as live chat, polls, or Q&A sessions.",Boolean [1],"Platform feature documentation, Platform official documentation, user guides, user reviews"
International Availability,Number of countries where the service is available.,Integer [1],"Official app websites, press releases"
Item Categories,The types of items that can be listed and sold on the platform.,Text [*],"Platform category listings, Platform guidelines, Platform official information, Platform official websites, user guides, user reviews"
Item Categories Supported,The range of product categories that can be listed for sale.,Text [*],"Platform guidelines, Platform's category listings, user guides, user interfaces"
Key Features,"Notable functionalities offered by the app, such as offline listening, personalized recommendations, or exclusive content.",Text [*],"App Store, App Store listings, Google Play Store, Official App Websites, Official app websites, user reviews"
Latency,"The delay between user input and on-screen response, influencing gameplay responsiveness.",Float [1],"Technical reviews, User reviews, technical analyses, user feedback"
Latency and Performance,"The responsiveness and smoothness of gameplay, influenced by server infrastructure and network optimization.",Text [1],"User reviews, performance benchmarks"
Listing Fees,The cost associated with listing an item for sale on the platform.,Float [1],"Platform pricing pages, Platform's pricing page, user agreements, user guides, user testimonials"
Live Sports Coverage,The availability and breadth of live sports events streamed on the platform.,Text [1],"turn0news13, turn0news14, turn0news15, turn0search0, turn0search1, turn0search2"
Live Streaming Quality,"The resolution and reliability of live streams, including factors like buffering, latency, and availability of high-definition or 4K content.",Text [1],"turn0news15, turn0news16"
Live TV Access,Availability of live television channels or events.,Boolean [1],"Official app websites, service descriptions"
Live TV and Events,Availability of live television channels or live events streaming.,Boolean [1],Official app websites
Live TV and Sports,Availability of live television channels and sports content.,Boolean [1],"Official app websites, content listings"
Live TV Availability,Access to live television channels or events through the platform.,Boolean [1],"Official app websites, industry reports, service descriptions"
Local Deals,Ability to find and alert users to deals available at nearby physical stores.,Boolean [1],"turn0search0, turn0search4, turn0search9"
Media Support,"The types of media (e.g., images, videos) that can be included in broadcast messages.",Text [1],"Official app documentation, app store listings"
Message Delivery Options,"The variety of methods available for sending messages, such as SMS, MMS, or in-app messaging.",Text [*],Official App Documentation
Message Delivery Reports,The ability to track and report on the delivery status of sent messages.,Boolean [1],"App Features List, User Guides"
Message Personalization,The ability to customize messages with placeholders for recipient-specific information.,Boolean [1],"App Documentation, App Features, App Features List, App feature lists, Official app features list, User Guides, User Reviews, user guides, user manuals"
Message Scheduling,The ability to schedule messages to be sent at a later time or date.,Boolean [1],"App Documentation, App Features, User Guides, User Reviews"
Mobile App Availability,Availability and functionality of mobile applications for listing and managing sales.,Boolean [1],"App stores, Platform official app stores, Platform's official app store listings, platform official websites, user reviews"
Monetization Options,"Availability of features that allow content creators to earn revenue, such as ads, subscriptions, or virtual gifts.",Boolean [1],"Official app websites, Platform feature documentation, Platform official documentation, turn0search1, turn0search2, user guides, user reviews, user testimonials"
Monetization Options for Creators,The opportunities available for content creators to earn revenue through the platform.,Text [1],"turn0search0, turn0search1, turn0search2"
Multi-Platform Availability,"Availability of the app across various platforms (iOS, Android, Web).",Boolean [1],"turn0search0, turn0search4, turn0search9"
Multimedia Support,"The ability to send images, videos, and other media types.",Boolean [1],"App Documentation, App Features, App feature lists, Official app websites, User Guides, User Reviews, user manuals, user reviews"
Music Library Size,Number of songs available in the app's catalog.,Integer [1],"Amazon Music, Anghami, App official documentation, App official statistics, Apple Music, Audiomack, Boomplay, Deezer, Gaana, Hungama Music, JioSaavn, Napster, Official app documentation, Official app websites, Pandora, Qobuz, Smart Shuffle, SoundCloud, Spotify, Tidal, Trebel, Wynk Music, YouTube Music, iHeartRadio, industry reports, press releases, turn0search17, turn0search19, turn0search20"
Note Organization Features,"The methods available for organizing notes, such as folders, tags, or notebooks.",Text [*],"Official app websites, user reviews"
Number of Downloads,Total number of times the app has been downloaded,Integer [1],"App Store, Apple App Store, Google Play Store"
Number of Retailers Supported,Total number of retailers or stores the app provides deals for.,Integer [1],"App Store descriptions, Official app websites"
Number of Reviews,Total number of user reviews for the app.,Integer [1],"App Store, Google Play Store"
Offline Access,The app's capability to function without an internet connection.,Boolean,"Official app websites, user manuals, user reviews"
Offline Functionality,Capability to transfer files without an internet connection.,Boolean [1],"Official app documentation, Official app features list, Official app websites, user guides, user manuals, user reviews"
Offline Listening,Availability of features that allow users to download episodes for offline playback.,Boolean [1],"App Store listings, Official app websites"
Offline Listening Capability,The ability to download episodes for offline playback.,Boolean [1],"App Descriptions, App Store listings, Official app websites, User Manuals, user reviews"
Offline Play,"The ability to download and play games without an internet connection, providing flexibility.",Boolean [1],"Official app websites, user manuals"
Offline Play Capability,"Whether the app allows downloading games for offline play, providing flexibility in gaming.",Boolean [1],"Official app specifications, user reviews"
Offline Playback,Ability to download songs for offline listening.,Boolean [1],"Amazon Music, Anghami, App official documentation, Apple Music, Audiomack, Boomplay, Deezer, Gaana, Hungama Music, JioSaavn, Napster, Official app documentation, Official app websites, Pandora, Qobuz, Smart Shuffle, SoundCloud, Spotify, Tidal, Trebel, Wynk Music, YouTube Music, iHeartRadio, turn0search17, turn0search18, turn0search20, user manuals, user reviews"
