name,description,type,sources
Offline Playback Capability,The app's ability to download songs for offline listening.,Boolean [1],App feature documentation
Offline Transfer Capability,"The ability to transfer files without an active internet connection, useful in areas with limited connectivity.",Boolean [1],"Official app documentation, Official app websites, user manuals, user reviews"
Offline Viewing,Availability of downloading content for offline viewing.,Boolean [1],"Official app websites, feature lists, industry reports, user guides"
Offline Viewing Capability,The ability to download content for offline viewing.,Boolean [1],"Official app websites, tech blogs"
Original Content,The number of exclusive movies and TV series produced by the platform.,Integer [1],"Official app websites, Official platform announcements, industry news outlets, industry reports, industry reviews, press releases"
Original Content Availability,"The presence and quantity of exclusive, original programming on the platform.",Integer [1],"Official app websites, industry reports"
Payment Methods,The payment options available for transactions on the platform.,Text [1],"Platform FAQs, user guides"
Payment Options,The methods available for buyers to pay and sellers to receive funds.,Text [1],"Platform official information, Platform payment information, Platform's payment information page, user feedback, user guides"
Payment Processing,The methods available for processing payments from buyers to sellers.,Text [*],"Platform payment policies, user agreements, user guides"
Payment Processing Options,The variety of payment methods supported for transactions.,Text [*],"Platform official websites, user guides"
Performance,Speed and stability of the app during use,Text [1],"User reviews, tech blogs"
Performance and Reliability,"The app's speed, responsiveness, and stability during use.",Text [*],"User reviews, expert evaluations, performance benchmarks, professional app reviews, tech articles"
Performance Optimization,Effectiveness of the app in enhancing gaming performance.,Text [1],"App Store, Google Play Store, Official App Websites, turn0search0, turn0search3, turn0search4"
Performance Optimization Features,Tools and settings available to enhance gaming performance.,Boolean [1],"App Descriptions, Official app websites, User Reviews, app store listings"
Personalization,Ability to provide personalized recommendations based on user preferences.,Text [1],"Official App Descriptions, User Reviews, User reviews, app descriptions"
Personalization and Recommendations,The app's ability to provide personalized content suggestions based on user preferences.,Text [1],"App Descriptions, User Feedback"
Personalized Recommendations,The app's capability to suggest movies based on user preferences and viewing history.,Boolean [1],"App Store, App Store listings, App algorithms, App feature descriptions, App feature documentation, Google Play Store, Official app websites, User data, User reviews, User testimonials, app store descriptions"
Platform Accessibility,"The availability of the app across different devices and operating systems, such as iOS, Android, smart TVs, and web browsers.",Text [1],"turn0search19, turn0search20, turn0search24"
Platform Availability,"The range of operating systems and devices on which the app is available (e.g., iOS, Android, Web).",Text [1],"Amazon Music, Anghami, App Documentation, App Store, App Store Listings, App Store descriptions, App Store listings, App documentation, App official website, App store listings, Apple Music, Audiomack, Boomplay, Company Website, Company Websites, Deezer, Gaana, Google Play Store, Hungama Music, JioSaavn, Napster, Official App Descriptions, Official App Documentation, Official App Website, Official App Websites, Official Website, Official Websites, Official app websites, Pandora, Qobuz, Smart Shuffle, SoundCloud, Spotify, TechRadar, Tidal, Trebel, Wikipedia, Wynk Music, YouTube Music, app store listings, app stores, iHeartRadio, official websites, turn0news13, turn0news14, turn0news17, turn0news23, turn0search0, turn0search1, turn0search15, turn0search16, turn0search17, turn0search19, turn0search2, turn0search20, turn0search3, turn0search4, turn0search5, turn0search7"
Platform Compatibility,The range of devices and operating systems the app supports.,Text [*],"App Descriptions, Official Websites, Official app documentation, Official app websites, Platform official documentation, Platform official website, app store listings, tech reviews, turn0news12, turn0news13, turn0news14, turn0news21, turn0news22, turn0news23, turn0search0, turn0search1, turn0search15, turn0search16, turn0search17, turn0search18, turn0search19, turn0search2, turn0search20, user manuals, user reviews"
Platform Popularity,The number of active users and overall reach of the platform.,Integer [1],"Platform official statistics, industry reports"
Price,"Cost of the app, including any in-app purchases or subscription fees.",Text [1],"App Store, Google Play Store, Official App Websites, official app websites"
Price Alerts,Ability to set alerts for price drops on specific products.,Boolean [1],"turn0search4, turn0search8"
Price Comparison,Ability to compare prices across multiple retailers to find the best deal.,Boolean [1],"turn0search0, turn0search1, turn0search2, turn0search3, turn0search4, turn0search6, turn0search9"
Price Tracking,Feature to track price changes over time and alert users to price drops.,Boolean [1],"turn0search0, turn0search1, turn0search4, turn0search5, turn0search6, turn0search7, turn0search8"
Price Tracking Accuracy,Reliability and accuracy of the app's price tracking features,Text [1],"Official App Website, User Reviews"
Pricing,"Cost of the app, including free tiers and premium plans.",Text [1],"App official websites, AppyPie, Official pricing pages, PCMag, TechRadar, Wikipedia, comparison articles, turn0news13, turn0news23, user reviews"
Pricing and Subscription Models,"The cost structure of the app, including free tiers, subscription plans, and one-time purchase options.",Text [*],"Official app websites, app store listings"
Pricing Model,"The cost structure of the app, including free tiers, subscription plans, and one-time purchases.",Text [1],"App Store, App Store Listings, App Store listings, Google Play Store, Official App Websites, Official app websites, app store listings, pricing pages, turn0news12, turn0news13, turn0news23, user reviews"
Privacy and Security,"The measures implemented to protect user data and communications, including end-to-end encryption and data policies.",Text [1],"App Store, Company Websites, Google Play Store, Official App Websites, Privacy Policies, Security Audits"
Safety Features,Measures implemented by the platform to ensure secure transactions and protect users.,Text [1],"Platform security pages, user feedback"
Scalability,The app's ability to accommodate growing teams and increasing workloads.,Text [1],"Product specifications, User reviews, case studies"
Scheduling Features,The ability to schedule messages to be sent at a later time or date.,Boolean [1],"App feature lists, user manuals"
Security,Measures in place to protect user data and ensure privacy.,Text [1],"TechRadar, Wikipedia"
Security and Privacy,"The measures taken by the app to protect user data, including encryption and privacy policies.",Text [1],"App Documentation, Official app websites, Security Audits, privacy policies, security audits, security whitepapers, tech articles, turn0news12, turn0news20, turn0search15, turn0search17"
Security Features,"The security measures implemented by the app, such as end-to-end encryption, password protection, and compliance with standards like GDPR.",Text [1],"App Documentation, Official App Documentation, Official app documentation, Official app websites, Official security documentation, Security Audits, Security Whitepapers, independent security audits, privacy policies, security audits, security whitepapers, turn0news12, turn0news13, turn0news14, turn0news21, turn0news22, turn0news23, turn0search0, turn0search1, turn0search15, turn0search16, turn0search17, turn0search18, turn0search19, turn0search20, user reviews"
Security Measures,The robustness of the app's security features to protect user data and privacy.,Text [1],"App documentation, AppyPie, PCMag, Security whitepapers, TechRadar, compliance certifications, security audits, turn0news13, turn0news14, turn0news17, turn0search20"
Seller Protection,Policies and measures in place to protect sellers from fraud or disputes.,Text [1],"Platform official information, user guides"
Seller Protection Policies,The measures in place to protect sellers from fraud and disputes.,Text [*],"Platform official websites, Platform terms of service, Platform's seller protection page, help centers, user experiences, user guides, user testimonials"
Shipping Options,The shipping services integrated with the platform and any associated costs.,Text [*],"Platform shipping policies, user guides, user reviews"
Shipping Support,The assistance or services provided by the platform for shipping items to buyers.,Text [1],"Platform features pages, Platform official information, Platform official websites, Platform shipping policies, Platform's shipping policies, user experiences, user guides"
Shuffle Play Feature,Availability of a shuffle play mode that allows users to play playlists in a randomized order.,Boolean [1],"Amazon Music, Anghami, App feature documentation, App official documentation, Apple Music, Audiomack, Boomplay, Deezer, Gaana, Hungama Music, JioSaavn, Napster, Official app documentation, Official app websites, Pandora, Qobuz, Smart Shuffle, SoundCloud, Spotify, Tidal, Trebel, Wynk Music, YouTube Music, iHeartRadio, turn0search0, turn0search1, turn0search17, turn0search18, turn0search2, turn0search20, turn0search3, turn0search4, user manuals, user reviews"
Social Features,"Features that allow users to connect, share, and discuss movies with friends or a community.",Boolean [1],"App Store, App features, Google Play Store, Official App Websites"
Social Integration,The app's features that allow sharing and discovering music with friends.,Boolean [1],App feature documentation
Social Networking Features,"Features that allow users to connect with friends, share recommendations, and see friends' ratings.",Boolean [1],"App feature descriptions, App feature set, User testimonials"
Storage Capacity,"The amount of data storage provided by the app, either free or paid.",Integer (GB) [1],"turn0news13, turn0news22"
Streaming Availability Information,Information on where movies are available for streaming.,Boolean [1],"App Store, Google Play Store, Official App Websites"
Streaming Capabilities,The ability to live-stream gameplay to platforms like YouTube or Twitch.,Text [1],"turn0search0, turn0search4"
Streaming Integration,Integration with streaming services to watch movies directly through the app.,Boolean [1],"App Store, Google Play Store"
Streaming Quality,The maximum video resolution and audio quality offered by the platform.,Text [1],"Official app specifications, Official app websites, Platform official documentation, Platform technical specifications, industry reports, tech blogs, tech reviews, tech specifications, technical documentation, technical reviews, technical specifications, user reviews"
Streaming Quality and Reliability,"The quality of video streams, including resolution options, buffering times, and overall reliability of the service.",Text [1],([tomsguide.com](https://www.tomsguide.com/us/youtube-tv-faq%2Creview-5059.html?utm_source=openai))
Subscription Cost,The monthly fee required to access the platform's content.,Float [1],"Amazon Music, Anghami, App Descriptions, App pricing information, Apple Music, Audiomack, Boomplay, Deezer, Gaana, Hungama Music, JioSaavn, Napster, Official Websites, Official app documentation, Official app websites, Official platform pricing pages, Pandora, Qobuz, Smart Shuffle, SoundCloud, Spotify, Tidal, Trebel, Wynk Music, YouTube Music, app store listings, iHeartRadio, industry reports, pricing pages, turn0news12, turn0news13, turn0news15, turn0news16, turn0search0, turn0search1, turn0search2"
Support and Resources,Availability of customer support and educational materials.,Text [*],"Help centers, community forums"
Synchronization and Backup,The app's ability to sync notes across devices and provide backup options.,Text [*],"Official app websites, user reviews"
Synchronization and Cloud Integration,The app's ability to sync notes across devices and integrate with cloud services for backup and accessibility.,Text [1],"Official app websites, user reviews"
Synchronization and Cloud Support,The app's ability to sync notes across devices and its support for cloud storage services.,Boolean,"Official app websites, user manuals"
Target Audience,The primary demographic or market segment the platform caters to.,Text [1],"Platform marketing materials, user demographics studies"
Task Management,"Capabilities for creating, assigning, and tracking tasks and projects.",Text [1],"App official websites, TechRadar, Wikipedia, turn0news12, turn0news17, turn0news23, turn0search15, turn0search17, user reviews"
Template Variety,Number and diversity of collage templates available.,Integer [1],"App Store, Google Play Store, Official App Websites"
Transaction Fees,The percentage or fixed fee deducted from the sale price upon a successful transaction.,Float [1],"Platform pricing pages, Platform's terms of service, user agreements, user guides, user reviews"
Transfer Method,"The underlying technology or protocol used by the app to transfer files, such as peer-to-peer, cloud-based, or Wi-Fi Direct.",Text [1],Official app documentation
Transfer Speed,The average speed at which files are transferred between devices using the app.,Float (MB/s) [1],"Independent performance tests, Independent speed tests, Official app documentation, Official app websites, Performance benchmarks, turn0search0, turn0search1, turn0search2, user reviews, user testimonials"
Unique Features,"Distinctive functionalities that set the app apart, such as personalized recommendations, offline listening, or exclusive content.",Text [*],"App Descriptions, App Store listings, Official app websites, Tech Reviews, Tech blogs, user reviews"
Update Frequency,How often the app is updated to fix bugs or add new features,Integer [1],"App Store, Google Play Store, Official App Websites"
User Base,"The number of active users on the platform, indicating its popularity and reach.",Integer [1],"App Store, Company Reports, Company reports, Google Play Store, Platform official reports, Platform official statistics, industry analyses, industry reports, turn0search19, turn0search21, turn0search24"
User Base Size,"The number of active users on the platform, indicating potential reach for sellers.",Integer,"Official app websites, Platform official statistics, Platform's official statistics, industry reports, turn0news13, turn0news14, turn0search0, turn0search1, turn0search15, turn0search16, turn0search17, turn0search2, turn0search3, turn0search4, turn0search5"
User Engagement Features,"Interactive tools such as live chat, polls, and Q&A that enhance audience participation.",Text [*],"Official app websites, Platform official websites, user reviews"
User Experience,"Overall ease of use, interface design, and user satisfaction.",Text [1],"App Store Ratings, User Reviews"
User Interaction Features,"The tools provided for audience engagement, including live chat, reactions, and virtual gifting.",Text [1],"turn0search1, turn0search2"
User Interface,"The design and usability of the app's interface, affecting ease of use and user experience.",Text [1],"([tomsguide.com](https://www.tomsguide.com/us/youtube-tv-faq%2Creview-5059.html?utm_source=openai)), App Store, App Store Screenshots, App Store listings, App official websites, AppyPie, Google Play Store, Official App Websites, PCMag, Platform official websites, TechRadar, User Reviews, User reviews, Wikipedia, app demonstrations, app documentation, app official documentation, app screenshots, app store descriptions, app store ratings, expert reviews, turn0news12, turn0news17, turn0news21, turn0news23, turn0search0, turn0search1, turn0search4, turn0search5, usability studies, user reviews"
User Interface and Ease of Use,The intuitiveness and user-friendliness of the app's interface.,Text [1],"User reviews, app demonstrations, app ratings, app store ratings, app walkthroughs, turn0news12, turn0news13, turn0news14, turn0news16, turn0news20, turn0news21, turn0news22, turn0news23, turn0search0, turn0search1, turn0search15, turn0search16, turn0search17, turn0search18, turn0search19, turn0search20"
User Interface and Experience,"The design, ease of navigation, and overall user experience of the app.",Text [1],"([tomsguide.com](https://www.tomsguide.com/us/youtube-tv-faq%2Creview-5059.html?utm_source=openai)), App Reviews, App Store, App Store listings, App Store reviews, App reviews, Google Play Store, Official App Websites, Tech Blogs, Tech blogs, User Feedback, User feedback, User reviews, User reviews and app descriptions, app critiques, app design analysis, app store listings, app store ratings, expert evaluations, industry analyses, industry evaluations, professional app reviews, tech articles, tech blogs, turn0news12, turn0news14, turn0news15, turn0news16, turn0search0, turn0search1, turn0search2, turn0search4, turn0search9, usability studies"
User Interface and Usability,"The design quality and ease of use of the app's interface, including customization options and user experience.",Text [*],"User reviews, app store ratings, tech blogs"
User Interface Design,The intuitiveness and aesthetic appeal of the app's interface.,Text [*],"Official app websites, user reviews"
User Interface Quality,The ease of navigation and overall user experience of the app.,Text [1],"App Descriptions, User Reviews, User reviews, app design analysis, industry analyses, tech blogs"
User Interface Simplicity,The ease of use and intuitiveness of the app's interface.,Text [1],"User reviews, app critiques"
User Rating,Average user rating on app stores,Float [1],"App Store, Google Play Store"
User Ratings,"Average user rating on app stores, indicating overall user satisfaction.",Float [1],"App Store, App store listings, Apple App Store, Google Play Store, Trustpilot, review platforms"
User Ratings and Reviews,"The ability for users to rate and review movies, providing personal insights and opinions.","Text, Integer [1]","App Store, App Store reviews, App stores, Google Play Store, Official App Websites, User-generated content, independent review sites"
User Reviews,Qualitative feedback from users about the app's performance and usability.,Text [*],"App Store, App Store Reviews, App store reviews, App stores, Google Play Reviews, Google Play Store, TechRadar, Third-Party Review Sites, User Review Aggregators, Wikipedia, independent review sites, review websites, turn0search0, turn0search4, turn0search9, user review platforms"
User Reviews and Ratings,"Feedback from users regarding their experiences with the app, reflecting satisfaction and reliability.",Float [1],"App Store, Google Play Store, Independent Review Sites, Review Aggregator Sites, Review Aggregators, User Review Platforms"
User Satisfaction,Average user rating or satisfaction score.,Float [1],"App store reviews, user surveys"
User Support,The quality and availability of customer support services.,Text [1],"turn0news23, turn0search21"
Watchlist Management,Tools for users to create and manage lists of movies they want to watch.,Boolean [1],"App Store, App feature descriptions, App feature set, Google Play Store, Official App Websites, User input"
Wishlist Functionality,Option to create and manage wishlists for tracking desired products.,Boolean [1],"turn0search0, turn0search4, turn0search9"
