name,description,type,sources
Audio Quality,"The quality of audio playback, including support for high-fidelity streaming.",Text [1],"App Reviews, App Store listings, User Feedback, User reviews, technical specifications"
Community and Social Features,"Features that allow user interaction, such as commenting, sharing, or live discussions.",Text [*],"App Store listings, Official app websites, user reviews"
Content Library,The size and diversity of the podcast library available through the app.,Text [1],"App Descriptions, App Store listings, Official app websites, User Feedback, User reviews"
Content Library Size,The number and variety of podcasts available on the platform.,Integer [1],"App Store, Google Play Store, Official App Websites, Official app websites, Press Releases, industry reports"
Cross-Platform Synchronization,The ability to sync listening progress and subscriptions across multiple devices.,Boolean [1],"App Store listings, Official app websites, user reviews"
Feature Set,"The variety and usefulness of features offered, such as offline listening, playlist creation, and playback controls.",Text [1],"App Descriptions, Official app websites, Tech reviews, User Manuals"
Integration with Other Services,"Compatibility with other platforms or services, such as smart speakers, car systems, or social media.",Text [1],"App Descriptions, App Store listings, Official app websites, User Manuals, technical specifications"
Key Features,"Notable functionalities offered by the app, such as offline listening, personalized recommendations, or exclusive content.",Text [*],"App Store, App Store listings, Google Play Store, Official App Websites, Official app websites, user reviews"
Offline Listening Capability,The ability to download episodes for offline playback.,Boolean [1],"App Descriptions, App Store listings, Official app websites, User Manuals, user reviews"
Platform Availability,"The range of operating systems and devices on which the app is available (e.g., iOS, Android, Web).",Text [1],"App Store, App Store listings, Google Play Store, Official App Websites, Official app websites"
Pricing Model,"The cost structure of the app, including free, freemium, or subscription-based models.",Text [1],"App Store, App Store Listings, App Store listings, Google Play Store, Official App Websites, Official app websites"
Unique Features,"Distinctive functionalities that set the app apart, such as personalized recommendations, offline listening, or exclusive content.",Text [*],"App Descriptions, App Store listings, Official app websites, Tech Reviews, Tech blogs, user reviews"
User Interface,"The design and usability of the app's interface, including intuitiveness and aesthetics.",Text [1],"App Store listings, User reviews, app screenshots"
User Interface and Experience,"The design, ease of navigation, and overall user experience of the app.",Text [1],"App Reviews, App Store listings, Tech Blogs, Tech blogs, User Feedback, User reviews, app critiques"
User Ratings,Average user ratings and reviews indicating overall user satisfaction.,Float [1],"App Store, Google Play Store"
