name,description,type,sources
Cost,"The pricing structure of the app, including free tiers and subscription options.",Text [1],"App Documentation, App Store, App Store Listings, Company Pricing Pages, Company Website, Google Play Store, Official App Documentation, Official Pricing Page, Official Pricing Pages, Official app websites, Official pricing pages, app store listings, turn0news13, turn0search0, turn0search1, turn0search2, turn0search3, turn0search4, turn0search5"
Customer Support,The availability and quality of customer support services.,Text [1],"Company Website, Official App Documentation, Official app websites, Support Pages, User Reviews, User Testimonials, user reviews"
Ease of Use,The user-friendliness and intuitiveness of the app's interface.,Text [1],"App Store Ratings, Expert Reviews, User Reviews, User reviews, independent app evaluations"
Group Size Limit,The maximum number of contacts to whom a message can be broadcast simultaneously.,Integer [1],"App Documentation, Company Support Pages, Official App Documentation, Official app documentation, Support Pages, User Reviews, app store listings, user guides"
Integration Capabilities,"The app's ability to integrate with other services or platforms, such as CRM systems or email marketing tools.",Boolean [1],"API Documentation, App Documentation, App feature lists, Company Support Pages, Company Website, Integration Guides, Official App Documentation, Official app documentation, Third-Party Reviews, integration documentation, integration guides"
Message Personalization,The ability to customize messages with placeholders for recipient-specific information.,Boolean [1],"App Documentation, App Features, App Features List, App feature lists, Official app features list, User Guides, User Reviews, user guides, user manuals"
Message Scheduling,The ability to schedule messages to be sent at a later time or date.,Boolean [1],"App Documentation, App Features, User Guides, User Reviews"
Multimedia Support,"The ability to send images, videos, and other media types in messages.",Boolean [1],"App Documentation, App Features, App feature lists, User Guides, User Reviews, user manuals"
Platform Availability,"The operating systems and devices on which the app is available (e.g., iOS, Android, Web).",Text [*],"App Documentation, App Store, Company Website, Google Play Store, Official App Documentation, Official Website, Official app websites, app store listings, turn0news13, turn0news14, turn0search0, turn0search1, turn0search15, turn0search16, turn0search17, turn0search2, turn0search3, turn0search4, turn0search5"
Security and Privacy,"The level of security and privacy features offered by the app, such as end-to-end encryption and data protection measures.",Text [1],"App Documentation, Security Audits, turn0news12, turn0search15, turn0search17"
Security Features,The presence of end-to-end encryption and other security measures to protect user data.,Boolean [1],"App Documentation, Official App Documentation, Official app documentation, Security Audits, Security Whitepapers, security whitepapers"
User Base,"The number of active users on the platform, indicating its popularity and reach.",Integer [1],"App Store, Company Reports, Google Play Store"
User Reviews,Feedback and ratings from users regarding the app's performance and reliability.,Text [*],"App Store, App Store Reviews, App store reviews, Google Play Reviews, Google Play Store, Third-Party Review Sites, User Review Aggregators, independent review sites"
User Reviews and Ratings,"Feedback from users regarding their experience with the app, indicating satisfaction and reliability.",Float [1],"App Store, Google Play Store, Review Aggregator Sites, Review Aggregators"
