name,description
Accessibility Features,"Incorporation of accessibility features for users with disabilities (e.g., captions, screen reader support)."
Cost,"The pricing structure of the app, considering free tiers, subscription options, and potential costs for additional features or users."
Customer Support,The responsiveness and quality of customer support available to users.
Customization Options,"The extent to which users can personalize the app's appearance, themes, and behavior to suit their preferences."
Device Compatibility,"The range of devices supported by the app, including iOS, Android, smart TVs, and web browsers."
Integration with Other Services,"Compatibility and seamless integration with other popular apps and platforms, such as email, messaging, and cloud storage."
Mobile App Performance,"The app's speed, stability, and responsiveness."
Popularity,"Based on app store ratings, download numbers, and user base size."
Regional Availability,The extent to which the app offers content in multiple countries and languages.
Regular Updates & Maintenance,"Frequency of app updates to address bugs, improve performance, and add new features."
Security,"Considers data encryption, access controls, and privacy features"
User Engagement,"Evaluates the app based on metrics such as daily active users and interaction rates, reflecting how actively users engage with friends through the platform."
User Interface,The ease of navigation and overall user experience within the app.
User Ratings,"Average rating from app store reviews, reflecting user satisfaction."
