name;description
Cross-Platform Availability;The availability of the app across different platforms (iOS, Android) and its compatibility with various devices and OS versions.
Cross-Platform Synchronization;The ability to maintain data consistency and user experience across different devices.
Customer Support;The availability and quality of customer support, including responsiveness to user queries, bug fixes, and troubleshooting assistance.
Customization Options;The level of customization available to users, such as themes, layout options, and the ability to tailor the app's functionality to individual preferences.
Feature Richness;Breadth and depth of features offered, including but not limited to core functionality, integrations, and customization options.
Geographic Coverage;Extent and granularity of supported regions worldwide.
Number of downloads;Total count of installs from official app stores, indicating popularity and reach.
Performance and Stability;The app's performance in terms of speed, responsiveness, and stability when handling large documents or multiple highlights without lag or crashes.
Pricing and Value;The cost of the app, including one-time purchases, subscriptions, and the value provided by free vs. premium features.
Security and Privacy;The strength and effectiveness of measures to protect user data and communications, including end-to-end encryption, data storage policies, and compliance with privacy regulations.
Update and Maintenance Frequency;The frequency and quality of updates to the app, including bug fixes, new features, and performance improvements.
User Engagement;The number of active users, reflecting the app's popularity and reach.
User Experience (UX);The ease of use of the app, including user interface design, navigation, and overall user experience.
User Rating;Average rating from major app stores, reflecting user satisfaction and reliability of the app.
