model,feature,name,description,type,sources
anthropic,Collaborate with others,User Base Size,"Total number of active users across all platforms, indicating adoption and network effects for collaboration",Integer [1],"Company reports, industry analytics, third-party research"
anthropic,Collaborate with others,Real-time Collaboration Features,"Number and quality of simultaneous collaboration capabilities like live editing, screen sharing, and instant messaging",Integer [1],"Feature documentation, app stores, user reviews"
anthropic,Collaborate with others,Cross-platform Compatibility,Number of platforms and devices supported for seamless collaboration across different environments,Integer [1],"Official websites, app stores, technical specifications"
anthropic,Collaborate with others,Integration Ecosystem,Number of third-party integrations and APIs available for workflow connectivity,Integer [1],"Integration marketplaces, developer documentation, official listings"
anthropic,Collaborate with others,User Rating Score,Average user rating across major app stores and review platforms,Float [1],"App Store, Google Play, Capterra, G2, Trustpilot"
anthropic,Collaborate with others,Real-time Collaboration Features,"Number and quality of simultaneous multi-user editing, commenting, and interactive features",Integer [1-10],"App store descriptions, feature documentation, user reviews"
anthropic,Collaborate with others,Cross-platform Compatibility,"Number of supported platforms including mobile, desktop, and web versions with feature parity",Integer [1-6],"Official app stores, developer websites, platform availability"
anthropic,Collaborate with others,Integration Ecosystem,Number of third-party app integrations and API connectivity options available,Integer [0-500+],"Integration marketplaces, API documentation, developer resources"
anthropic,Collaborate with others,User Adoption Rate,Monthly active users and market penetration within collaboration software category,Integer [millions],"Company reports, market research, app store statistics"
anthropic,Collaborate with others,Communication Versatility,"Range of communication methods supported including text, voice, video, screen sharing, and file collaboration",Integer [1-8],"Feature lists, app descriptions, user documentation"
anthropic,Collaborate with others,Active User Base,Total number of monthly active users indicating widespread adoption and network effects for collaboration,Integer [1],"App store analytics, company reports, third-party research"
anthropic,Collaborate with others,Cross-Platform Availability,"Number of platforms supported (iOS, Android, Web, Desktop) ensuring accessibility across devices",Integer [1],"Official app stores, company websites"
anthropic,Collaborate with others,Real-Time Collaboration Features,"Presence and quality of simultaneous multi-user editing, live cursors, instant sync capabilities",Boolean [*],"Feature documentation, user reviews, hands-on testing"
anthropic,Collaborate with others,Integration Ecosystem,Number of third-party app integrations available for extending collaboration workflows,Integer [1],"Official integration directories, API documentation"
anthropic,Collaborate with others,Communication Versatility,"Range of communication methods supported including text, voice, video, screen sharing, and file sharing",Integer [1],"Feature lists, product specifications, user testing"
anthropic,Collaborate with others,Real-time Collaboration Features,"Number and quality of real-time collaboration capabilities including simultaneous editing, live cursors, instant messaging, and synchronized updates",Integer [1-10],"App store descriptions, feature lists, user reviews, official documentation"
anthropic,Collaborate with others,Cross-platform Compatibility,"Number of supported platforms and operating systems including mobile, desktop, web, and integration capabilities",Integer [1-8],"App store availability, official website, platform specifications"
anthropic,Collaborate with others,User Base and Network Effect,"Total number of active users and adoption rate in professional environments, measured in millions",Float [0-500],"Company reports, market research, app store statistics, industry surveys"
anthropic,Collaborate with others,Communication Quality,"Quality of audio/video calls, messaging reliability, and notification systems rated on effectiveness",Integer [1-10],"User reviews, technical specifications, performance tests, expert evaluations"
anthropic,Collaborate with others,Workflow Integration,Number of third-party integrations and native workflow automation features available,Integer [0-1000],"Integration marketplaces, API documentation, feature comparisons, official listings"
anthropic,Collaborate with others,Real-time Collaboration Features,"Number and quality of simultaneous multi-user editing, live cursor tracking, instant sync, and concurrent work capabilities",Integer [1-10],"App store descriptions, feature documentation, user reviews"
anthropic,Collaborate with others,Communication Integration,"Built-in messaging, video calling, voice chat, comments, mentions, and notification systems",Integer [1-10],"App specifications, feature lists, user testimonials"
anthropic,Collaborate with others,Cross-Platform Compatibility,"Availability and feature parity across mobile, desktop, web, and tablet platforms",Integer [1-5],"Platform availability data, compatibility documentation"
anthropic,Collaborate with others,User Adoption and Network Effect,"Total active users, download numbers, and likelihood of team members already using the platform",Integer [millions],"App store statistics, company reports, market research"
anthropic,Collaborate with others,Workflow Integration Capabilities,"Number of third-party integrations, API availability, and ability to connect with other business tools",Integer [1-100+],"Integration directories, API documentation, marketplace listings"
anthropic,Collaborate with others,Active User Base Size,"Total number of monthly active users across all platforms, indicating collaboration reach and network effect potential",Integer [1],"Company reports, market research firms, app analytics platforms"
anthropic,Collaborate with others,Real-time Collaboration Features,"Number and quality of simultaneous collaboration capabilities like live editing, screen sharing, instant messaging, and co-creation tools",Integer [1],"App feature documentation, user reviews, feature comparison sites"
anthropic,Collaborate with others,Cross-platform Compatibility,"Number of supported platforms and devices including mobile, desktop, web, and integration capabilities with other tools",Integer [1],"Official app stores, developer documentation, compatibility matrices"
anthropic,Collaborate with others,Enterprise Adoption Rate,"Percentage of Fortune 500 companies and large organizations using the platform, indicating reliability and scalability for team collaboration",Float [1],"Enterprise software reports, case studies, business intelligence platforms"
anthropic,Collaborate with others,User Satisfaction Score,"Average rating across major app stores and review platforms, reflecting overall user experience and collaboration effectiveness",Float [1],"App Store ratings, Google Play ratings, enterprise software review sites"
anthropic,Collaborate with others,Real-time Collaboration Features,"Number and quality of simultaneous multi-user editing, commenting, and interaction capabilities",Integer [1-10],"App store descriptions, feature documentation, user reviews"
anthropic,Collaborate with others,Cross-platform Compatibility,"Number of supported platforms including mobile, desktop, web, and operating system coverage",Integer [1-8],"Official app listings, platform availability, technical specifications"
anthropic,Collaborate with others,User Adoption Rate,Monthly active users and market penetration within collaboration software category,Integer [millions],"Public company reports, market research data, app store statistics"
anthropic,Collaborate with others,Integration Ecosystem,Number of third-party integrations and API connectivity with other productivity tools,Integer [1-500+],"Official integration directories, API documentation, marketplace listings"
anthropic,Collaborate with others,Communication Versatility,"Range of communication methods supported including text, voice, video, screen sharing, and file sharing",Integer [1-6],"Feature lists, user manuals, product demonstrations"
anthropic,Collaborate with others,Active User Base,Monthly active users indicating widespread adoption and network effects for collaboration,Integer [1],"App store data, company reports, third-party analytics"
anthropic,Collaborate with others,Real-time Collaboration Features,"Number and quality of simultaneous collaboration tools like live editing, screen sharing, video calls",Integer [1],"Feature documentation, user reviews, product specifications"
anthropic,Collaborate with others,Cross-platform Compatibility,Number of supported platforms and devices for seamless collaboration across different environments,Integer [1],"Official platform support lists, compatibility documentation"
anthropic,Collaborate with others,Integration Ecosystem,Number of third-party integrations and API connections enabling workflow consolidation,Integer [1],"Integration marketplaces, API documentation, partnership announcements"
anthropic,Collaborate with others,User Rating Score,Average user satisfaction rating across major app stores reflecting overall collaboration experience,Float [1],"App Store ratings, Google Play ratings, enterprise review platforms"
anthropic,Collaborate with others,Real-time Collaboration Features,"Number and quality of simultaneous editing, commenting, and live interaction capabilities",Integer [1-10],"App store descriptions, feature documentation, user reviews"
anthropic,Collaborate with others,Cross-platform Availability,"Number of platforms supported (mobile, desktop, web) and seamless synchronization",Integer [1-5],"Official app stores, developer websites, platform compatibility lists"
anthropic,Collaborate with others,User Base Size,Total number of active users indicating network effect and collaboration potential,Integer [millions],"Company reports, market research, app store download statistics"
anthropic,Collaborate with others,Integration Ecosystem,Number of third-party integrations and API connections available,Integer [0-500+],"Developer documentation, marketplace listings, integration directories"
anthropic,Collaborate with others,Team Management Capabilities,"Sophistication of user roles, permissions, and organizational features",Integer [1-10],"Feature specifications, admin documentation, enterprise reviews"
anthropic,Collaborate with others,Active User Base,Total number of monthly active users indicating platform adoption and network effect potential,Integer [1],"App store analytics, company reports, market research"
anthropic,Collaborate with others,Collaboration Feature Depth,"Comprehensive score based on real-time editing, file sharing, communication tools, project management, and workflow integration capabilities",Integer [1],"Feature analysis, user reviews, product documentation"
anthropic,Collaborate with others,Cross-Platform Compatibility,"Number of platforms supported including mobile, desktop, web, and seamless synchronization across devices",Integer [1],"App store listings, official websites, compatibility documentation"
anthropic,Collaborate with others,User Satisfaction Rating,Average rating across major app stores weighted by review volume and recency,Float [1],"App Store, Google Play, enterprise review platforms"
anthropic,Collaborate with others,Enterprise Integration Capability,Number of third-party integrations and API availability for business workflow automation,Integer [1],"Integration marketplaces, API documentation, enterprise feature lists"
