model,feature,name,description,type,sources
openai,Collaborate with others,User Interface,"The design and usability of the app's interface, affecting ease of use and user experience.",Text [1],"TechRadar, PCMag, AppyPie"
openai,Collaborate with others,Communication Features,"The range and quality of communication tools available, such as chat, video calls, and file sharing.",Text [1],"TechRadar, PCMag, AppyPie"
openai,Collaborate with others,Integration Capabilities,"The ability to integrate with other tools and services, enhancing workflow efficiency.",Text [1],"TechRadar, PCMag, AppyPie"
openai,Collaborate with others,Pricing,"The cost of the app, including free tiers and premium plans, and the value they offer.",Text [1],"TechRadar, PCMag, AppyPie"
openai,Collaborate with others,Security Measures,The robustness of the app's security features to protect user data and privacy.,Text [1],"TechRadar, PCMag, AppyPie"
openai,Collaborate with others,User Interface,"The design and usability of the app's interface, affecting ease of use and user experience.",Text [1],"turn0news12,turn0news23"
openai,Collaborate with others,Communication Features,"The range and quality of communication tools available, such as chat, video calls, and file sharing.",Text [1],"turn0news12,turn0news13"
openai,Collaborate with others,Integration Capabilities,"The ability to integrate with other tools and services, enhancing workflow efficiency.",Text [1],"turn0news16,turn0news14"
openai,Collaborate with others,Task Management,"Features that support task creation, assignment, tracking, and completion.",Text [1],"turn0news23,turn0search17"
openai,Collaborate with others,Collaboration Tools,"Tools that facilitate teamwork, such as shared workspaces, real-time editing, and commenting.",Text [1],"turn0search18,turn0search19"
openai,Collaborate with others,Security Measures,The level of security provided to protect user data and communications.,Text [1],"turn0news14,turn0search20"
openai,Collaborate with others,Pricing,"The cost of the app, including free tiers and premium plans.",Text [1],"turn0news23,turn0news13"
openai,Collaborate with others,Platform Availability,"The range of platforms (e.g., Windows, macOS, iOS, Android) on which the app is available.",Text [1],"turn0search20,turn0search19"
openai,Collaborate with others,User Support,The quality and availability of customer support services.,Text [1],"turn0news23,turn0search21"
openai,Collaborate with others,Customization Options,The extent to which users can customize the app to fit their specific needs.,Text [1],"turn0search2,turn0search1"
openai,Collaborate with others,User Interface,"The design and layout of the app, affecting ease of use and user experience.",Text [1],"TechRadar, Wikipedia"
openai,Collaborate with others,Communication Features,"Tools available for messaging, video calls, and real-time collaboration.",Text [1],"TechRadar, Wikipedia"
openai,Collaborate with others,Task Management,"Capabilities for creating, assigning, and tracking tasks and projects.",Text [1],"TechRadar, Wikipedia"
openai,Collaborate with others,Integrations,The ability to connect with other apps and services to enhance functionality.,Text [1],"TechRadar, Wikipedia"
openai,Collaborate with others,Pricing,"Cost of the app, including free tiers and premium plans.",Text [1],"TechRadar, Wikipedia"
openai,Collaborate with others,Security,Measures in place to protect user data and ensure privacy.,Text [1],"TechRadar, Wikipedia"
openai,Collaborate with others,Platform Availability,The operating systems and devices on which the app is available.,Text [1],"TechRadar, Wikipedia"
openai,Collaborate with others,Collaboration Tools,"Features that facilitate teamwork, such as shared workspaces and document editing.",Text [1],"TechRadar, Wikipedia"
openai,Collaborate with others,Customization,Options available to tailor the app to specific team needs and workflows.,Text [1],"TechRadar, Wikipedia"
openai,Collaborate with others,User Reviews,Feedback and ratings from users regarding their experience with the app.,Text [1],"TechRadar, Wikipedia"
openai,Collaborate with others,User Interface,"The design and usability of the app's interface, affecting ease of navigation and user experience.",Text [1],"User reviews, app documentation"
openai,Collaborate with others,Communication Features,"The range and quality of communication tools available, such as chat, video conferencing, and file sharing.",Text [1],"App feature lists, user reviews"
openai,Collaborate with others,Integration Capabilities,"The ability to integrate with other tools and services, enhancing workflow efficiency.",Text [1],"App documentation, third-party reviews"
openai,Collaborate with others,Pricing Model,"The cost structure of the app, including free tiers and premium plans.",Text [1],"Official app websites, pricing pages"
openai,Collaborate with others,Security Measures,"The robustness of the app's security features, including data encryption and compliance standards.",Text [1],"App documentation, security audits"
openai,Collaborate with others,Platform Availability,"The range of platforms (e.g., Windows, macOS, iOS, Android) on which the app is available.",Text [1],"App documentation, app store listings"
openai,Collaborate with others,Collaboration Tools,"Features that facilitate teamwork, such as shared workspaces, task assignments, and real-time editing.",Text [1],"App feature lists, user reviews"
openai,Collaborate with others,Customization Options,The extent to which the app allows users to tailor features and workflows to their needs.,Text [1],"App documentation, user reviews"
openai,Collaborate with others,Scalability,The app's ability to accommodate growing teams and increasing workloads.,Text [1],"User reviews, case studies"
openai,Collaborate with others,Customer Support,"The quality and availability of support services, including documentation, forums, and direct assistance.",Text [1],"User reviews, official support channels"
openai,Collaborate with others,User Interface,"The design and usability of the app's interface, affecting ease of use and user experience.",Text [1],"turn0news12,turn0news23"
openai,Collaborate with others,Communication Features,"The app's capabilities for messaging, video conferencing, and other communication tools.",Text [1],"turn0news12,turn0news13"
openai,Collaborate with others,Integration Capabilities,"The ability of the app to integrate with other tools and services, enhancing workflow efficiency.",Text [1],"turn0news17,turn0news14"
openai,Collaborate with others,Task Management,"Features that allow users to create, assign, and track tasks and projects.",Text [1],"turn0news23,turn0search15"
openai,Collaborate with others,Security Measures,"The app's provisions for data protection, encryption, and user privacy.",Text [1],"turn0news14,turn0search20"
openai,Collaborate with others,User Interface,"The design and layout of the app, affecting ease of use and user experience.",Text [1],"TechRadar, Wikipedia"
openai,Collaborate with others,Communication Features,"Tools available for messaging, video calls, and real-time collaboration.",Text [1],"TechRadar, Wikipedia"
openai,Collaborate with others,Task Management,"Capabilities for creating, assigning, and tracking tasks and projects.",Text [1],"TechRadar, Wikipedia"
openai,Collaborate with others,Integrations,The ability to connect with other apps and services to enhance functionality.,Text [1],"TechRadar, Wikipedia"
openai,Collaborate with others,Pricing,"Cost of the app, including free tiers and premium plans.",Text [1],"TechRadar, Wikipedia"
openai,Collaborate with others,User Interface,"The design and layout of the app, affecting ease of use and user experience.",Text [1],"TechRadar, Wikipedia"
openai,Collaborate with others,Communication Features,"Tools available within the app for messaging, video calls, and other forms of communication.",Text [1],"TechRadar, Wikipedia"
openai,Collaborate with others,Task Management,"Capabilities for creating, assigning, and tracking tasks and projects.",Text [1],"TechRadar, Wikipedia"
openai,Collaborate with others,Integrations,The ability of the app to connect and work with other software and services.,Text [1],"TechRadar, Wikipedia"
openai,Collaborate with others,Pricing,"The cost of using the app, including free tiers and premium plans.",Text [1],"TechRadar, Wikipedia"
openai,Collaborate with others,User Interface,"The design and layout of the app, affecting ease of use and user experience.",Text [1],"turn0news12,turn0news17,turn0news23"
openai,Collaborate with others,Communication Features,"Tools and functionalities that facilitate messaging, video calls, and real-time collaboration.",Text [1],"turn0news12,turn0news13,turn0news17"
openai,Collaborate with others,Integration Capabilities,The ability of the app to connect and work seamlessly with other software and services.,Text [1],"turn0news12,turn0news17,turn0news14"
openai,Collaborate with others,Task Management,"Features that allow users to create, assign, and track tasks and projects.",Text [1],"turn0news12,turn0news23,turn0news17"
openai,Collaborate with others,File Sharing and Storage,Functionalities that enable users to share and store files securely within the app.,Text [1],"turn0news14,turn0news13,turn0news17"
openai,Collaborate with others,Security Measures,Protocols and features implemented to protect user data and ensure privacy.,Text [1],"turn0news14,turn0news13,turn0news17"
openai,Collaborate with others,Pricing Model,"The cost structure of the app, including free tiers and premium plans.",Text [1],"turn0news12,turn0news13,turn0news23"
openai,Collaborate with others,Platform Availability,The range of devices and operating systems on which the app is accessible.,Text [1],"turn0news13,turn0news17,turn0news23"
openai,Collaborate with others,User Interface,"The design and layout of the app, affecting ease of use and user experience.",Text [1],"App official websites, user reviews"
openai,Collaborate with others,Communication Features,"Tools available for messaging, video calls, and real-time collaboration.",Text [1],"App official websites, user reviews"
openai,Collaborate with others,Task Management,"Capabilities for creating, assigning, and tracking tasks and projects.",Text [1],"App official websites, user reviews"
openai,Collaborate with others,Integrations,The ability to connect with other apps and services to enhance functionality.,Text [1],"App official websites, user reviews"
openai,Collaborate with others,Pricing,"Cost of the app, including free tiers and premium plans.",Text [1],"App official websites, user reviews"
openai,Collaborate with others,User Base,Number of active users or organizations utilizing the app.,Integer [1],"Company reports, industry analyses"
openai,Collaborate with others,Integration Capabilities,Number and variety of third-party applications the app can integrate with.,Integer [1],"Official app documentation, tech reviews"
openai,Collaborate with others,Feature Set,Range and depth of functionalities offered by the app.,Text [*],"Product descriptions, user manuals"
openai,Collaborate with others,Platform Availability,"Number of platforms (e.g., Windows, macOS, iOS, Android) the app supports.",Integer [1],"Official app websites, app store listings"
openai,Collaborate with others,Security Measures,"Level of security features implemented, such as end-to-end encryption.",Text [*],"Security whitepapers, compliance certifications"
openai,Collaborate with others,User Satisfaction,Average user rating or satisfaction score.,Float [1],"App store reviews, user surveys"
openai,Collaborate with others,Pricing,"Cost of the app, including free tiers and premium plans.",Text [*],"Official pricing pages, comparison articles"
openai,Collaborate with others,Scalability,Ability of the app to accommodate teams of varying sizes.,Text [*],"Product specifications, case studies"
openai,Collaborate with others,Ease of Use,User-friendliness and learning curve associated with the app.,Text [*],"User reviews, usability studies"
openai,Collaborate with others,Support and Resources,Availability of customer support and educational materials.,Text [*],"Help centers, community forums"
